product_group,name,product_url,image_url,short_description,description,sku,sku_name,sku_url,sku_image_url,sku_description,ccids,category_breadcrumbs,price,final_price,is_active,product_type,set_skus,bundle_skus,stock_quantity,stock_unit,sku_sequence,add_to_cart,quick_view or quick_look ,search_keywords,additional_image_urls,additional_sku_image_urls,promotion_flag,save_off,brand,brand_code,mobile_product_url,mobile_image_url,mobile_sku_url,mobile_sku_image_url,color,color_display_name,color_rgb,size,review_rating,review_count,review_link,margin,rankby1,rankby2,map_message,dyn_attrs,dyn_attrs_numeric,release_date,expiration_date
PSPSCHF,Classic Hardtail Frame,/shop/products/PSPSCHF/striva-classic-hardtail-frame,https://ch.sitecoredemo.com/api/public/content/frame-product?v=db4c59d2,The Classic hardtail frame has a good sense of use and long life. Sturdy and durable.,"Feature:
1. The bike front fork frame is made of ultralight carbon fiber material.
2. Has a good sense of use and long life. Sturdy and durable.
3. It has excellent hardness, no deformation, and corrosion resistance.
4. Professional manufacturing, can replace your old or broken bike frame.
5. Comes with seat post clip, tube shaft, and tail hook. A wonderful accessory for every mountain bike.

Specification:
Item Type: Bike Front Fork Frame
Material: Carbon&nbsp;Fiber
Color: As Pictures Shown
Weight: Approx. 3600g/127oz
Taper&nbsp;top&nbsp;pipe size: Approx. 41.8(42mm)/1.7in(top), 52mm/2in(down)Seat Tube Adaptation: Approx. 27.2mm/1.1in seat tube
Bottom Bracket:&nbsp;PF30, 73mm/2.9in
Rear Fork: 148x12mm/5.8x0.5in
29ER: Can be matched with 27.5, 29ER wheelset
Frame distribution: seatpost&nbsp;clip,&nbsp;tube&nbsp;shaft, and tailhook
(has been installed on the bike frame)",PSPSCHF,,,,,PSACEM,,250,250,,,,,,,,,,,,,,,Striva,,,,,,,,,,,,,,,,,,,,
PSPPSSGB,Sunday Golf Bag,/shop/products/PSPPSSGB/pro-staff-sunday-golf-bag,https://ch.sitecoredemo.com/api/public/content/sunday-golf-bag-product?v=23b29a0c,The most compact golf bag in the world.,"Carry/Sunday bags are the most compact of all golf bags.

They are structure-less and easy to carry.
They can be folded up for easy storage, and on the course, their main function is to carry the bare essentials.

There is a hookup for a golf towel, a single large pocket, and a ball pocket, but that’s about it.

Their lightweight design make the ""Pro Staff Sunday Golf Bag"" great for sneaking in a fast round in the morning before work or if you want to bring your sticks on the road but are tight on storage.",PSPPSSGB,,,,,PSAGA,,1000,1000,,,,,,,,,,,,,,,Pro Staff,,,,,,,,,,,,,,,,,,,,
PSPPSGCS,Golf Clubs Set,/shop/products/PSPPSGCS/pro-staff-golf-clubs-set,https://ch.sitecoredemo.com/api/public/content/golf-set-1-product?v=3b5d1507,"This set has you covered from tee to green with the confidence you need to make every shot!
","The new ""Pro Staff Golf Iron Clubs Set"" is packed with distance and forgiveness technology to help you hit more accurate shots more easily. This set has you covered from tee to green with the confidence you need to make every shot from the driver, fairway wood, and hybrid on through the irons, wedges, and mallet-shaped putter. It all comes packed in a convenient stand bag so you can carry it down the fairways with ease.

Features:
The lightweight 460cc driver features a larger sweet spot, more forgiveness, and a graphite shaft for longer shots off the tee
Fairway wood with a stainless steel clubhead and graphite shaft promotes faster swing speeds and longer shots
Confidence-inspiring hybrid is a great alternative to long irons for more confidence and versatility in the long game
Irons and wedges with perimeter weighting and progressive sole widths provide improved control
Mallet style putter with alignment aids for more accuracy and stability rolling putts
Lightweight, durable stand bag features five pockets, an additional cooler pocket, backpack-style straps for easy carrying, and a convenient rain hood",PSPPSGCS,,,,,PSAGG,,985,985,,,,,,,,,,,https://ch.sitecoredemo.com/api/public/content/golf-set-2-product?v=87653ac6 | https://ch.sitecoredemo.com/api/public/content/golf-set-3-product?v=dde21e9a,,,,Pro Staff,,,,,,,,,,,,,,,,,,,,
PSPSCMEKGM,Mobile EKG Monitor,/shop/products/PSPSCMEKGM/sydney-cummings-mobile-ekg-monitor,https://ch.sitecoredemo.com/api/public/content/ekg-monitor-product?v=5298fe31,The Sydney Cummings Mobile EKG Monitor is one of the most personal and practical smart EKG monitors on the market. It works with your iPhones or smartphones and thanks to its super small design it fits in your pocket. The EKG monitor measures your heart rate.,"The power is in your hands when it comes to your heart health thanks to the Sydney Cummings Mobile EKG Monitor. This innovative device pairs with just about any smartphone to give you almost instant EKG results.
Personal digital EKG device

Using your fingertips to capture medical-grade EKG in 30 seconds
Track EKG recordings and interpretations between doctor visits
Track multiple risk factors (EKG, blood pressure, activity, weight) in a single platform
Create a personal heart profile with artificial intelligence technology
Capture heart rate and symptoms such as irregular heartbeat, Atrial fibrillation, and more
Mobile EKG and algorithms with 98% sensitivity and 97% specificity for instant detection of AF
Single-lead rhythm strip comparable to Lead 1 of standard EKG machines, and is the most clinically-validated mobile EKG solution available
State and record symptoms while taking EKG;
Store your most recent EKG recording and analysis
Share results with your doctor
AliveCor is HIPAA compliant
1 Year Warranty
3V CR2016 coin cell battery
Basic app service included
Phone not included
Compatible with iOs iPhones: 5 through 12, plus iPod Touch 7th Gen, iPad Air, Pro, and Mini; Andriod Devices: Samsung Galaxy S5-S10, Samsung notebooks 5-10, LG Nexus 5, HTC One, Google Pixel and Pixel XL 1-5
Unlock comprehensive control over your heart health with a 30-day trial to our Premium service which gives you access to:

Unlimited EKG cloud storage and history
Monthly printed summary report of all the EKG&rsquo;s taken in a 30 day period
Blood Pressure Monitoring
Weight tracking and medication information
Heart Health Journal that integrates with Google Fit or Apple Health Apps",PSPSCMEKGM,,,,,PSEWH,,50,50,,,,,,,,,,,https://ch.sitecoredemo.com/api/public/content/ekg-monitor-2-product?v=da5267d2,,,,Sydney Cummings,,,,,,,,,,,,,,,,,,,,
PSPSCW,Watch,/shop/products/PSPSCW/sydney-cummings-watch,https://ch.sitecoredemo.com/api/public/content/smart-watch-product?v=869a341f,"A highly functional, durable, and water-resistant watch. This sports watch is easily legible, somewhat shockproof, and very resistant to scratches and physical contact.","A rugged, water-resistant wristwatch that includes features such as an alarm, stopwatch, compass, heart rate monitor, tachymeter (rotating bezel for calculating speed), thermometer, and tide indicator (for divers).
",PSPSCW,,,,,PSEWA|PSARE|PSAFE|PSACE,,450,450,,,,,,,,,,,https://ch.sitecoredemo.com/api/public/content/smart-watch-2-product?v=27dd8ea1,,,,Sydney Cummings,,,,,,,,,,,,,,,,,,,,
PSPSCP,Pillowbot,/shop/products/PSPSCP/sydney-cummings-pillowbot,https://ch.sitecoredemo.com/api/public/content/pillow-product?v=9455bc35,"Take back control of your sleep. Decades of research show that breathing can slow the racing thoughts that often keep us awake. The Sydney Cummings' Pillowbot is a drug-free solution with no side effects. The Pillowbot helps you fall asleep relaxed and wake up well-rested, so you can be at your best every day!","The Sleep Robot has sensors that detect your breathing rate. Through these measurements, the Pillowbot can adapt itself to your breathing and gently slow it down. Quiet breathing has been proven to reduce stress and calm your mind.

The Pillowbot can play soothing music, nature sounds, or white/pink noise. These sounds help you relax and can enhance the Pillowbot&rsquo;s calming effect.

With the Pillowbot Mobile App, you can easily adjust the settings of your Pillowbot to your personal preferences. In the app, you can change your breathing program or choose your favorite soothing sounds and music.",PSPSCP,,,,,PSEWH,,650,650,,,,,,,,,,,,,,,Sydney Cummings,,,,,,,,,,,,,,,,,,,,
PSPSCN,Nutridis,/shop/products/PSPSCN/sydney-cummings-nutridis,https://ch.sitecoredemo.com/api/public/content/nutridis-product?v=173865b1,An automated dispenser for nutrient supplements,"A machine, that is an automated dispenser for nutrient supplements. Nutridis&nbsp;provides exactly the amount of supplement required thereby eliminating the excess. It takes in multiple dietary supplements and keeps them in the internal compartments. Basis the user, the machine will dispense just the amount of solid and semi-solid supplements required at a designated time.
",PSPSCN,,,,,PSEWH,,750,750,,,,,,,,,,,https://ch.sitecoredemo.com/api/public/content/nutridis-2-product?v=b05d3b08,,,,Sydney Cummings,,,,,,,,,,,,,,,,,,,,
PSPSCBS,Body Scale,/shop/products/PSPSCBS/sydney-cummings-body-scale,https://ch.sitecoredemo.com/api/public/content/smartscalelead-product?v=f3fa0813,"In addition to basic weighing tasks, a high-precision bioimpedance chip can perform a body composition measurement, calculate muscle mass, body fat percentage, bone mass, and more, while its sensors are said to fit G are accurate to 50 g. You can also register data of up to 16 profiles/people with a visitor mode without recording.","Powered by 3x AAA batteries
Supports kg and lb readouts
Measurement range between 100g (3.52 oz) and 150kg (23.6 stone)
Reinforced wipe-clean glass finish with floating display
High-precision BIA measurement chip
30cm long, 30cm wide, 2.5cm thick weighing 1.7kg
Smartphone and app required
Naturally the smart scale is for anyone wanting to weigh themselves, however there are plenty of other use cases:

Families wanting to track kids weight
Athletes monitoring looking to monitor trends of muscle mass and hydration
Those looking for a tool to aid them in losing weight through monitoring
Parcel measuring for items over 100g
Weight loss groups/classes of up to 16 people",PSPSCBS,,,,,PSEWH,,250,250,,,,,,,,,,,,,,,Sydney Cummings,,,,,,,,,,,,,,,,,,,,
